P,정부는 러시아와의 관계가 있으니 대외적으로는 금지하는 모습을 외교적으로 보여주고 실제로는 사후에 면책이나 사면해주면 됨
P,진짜 용기가 대단합니다 목숨걸고 전쟁터를 간다는게 쉽지 않았을텐데요 꼭 팀원전원 살아서 돌아오시길~~ 화이팅 하세요~~ 응원합니다~
N,그냥 돌아온다에 한표 이유는 현지상황상 어쩌고저쩌고어그로만 끌게 분명하다
P,살아서 돌아와라
N,옳은 일을 위해선 법을 어겨도 괜찮다는 것을 잘 알게 되었습니다.
P,급이 다르네요..와 ~~~꼭 살아돌아오시길..
N,"아이고~ 이게 뭔!!!겜인줄아나!!!un도 개입못하는판국에 우크라이나 출신도아니고,부모님이 우크라이나분들도아닌데! 거기가서 러시아군인 쏴죽인들 누가 잘했다할지..생각이있는건지없는건지 에효..."
N,거긴 총 맞아 죽는데가 아니고 포 맞아 죽는덴데...
N,UDT들중 멀쩡한애 없다던 SSU 출신이 했던 말이 생각나네 ㅋㅋㅋ
P,이왕 갔으니 용감하게 싸우시고 무사귀환하세요🙏
N,솔직히 못 믿겠다 영웅놀이 하는듯한 생각이든다
P,건강한 모습으로 다시 글 올려 주십시오..
N,대위 타이틀떼라!!! 뭔 아직도 대위?! 🐕 웃겨!!!
N,전쟁광들 모여라 하는구만. 가야할때랑 기다려야 할때 가려야지
N,나대지마라
N,영웅인척ㄴㄴ
N,모르게 가던가 .... 어차피 바로 돌아올꺼아냐?
P,내 상상이상이다..꼭 살아돌아오세요
P,와..진짜 개멋있다....진짜 존경합니다
N,싸우는게 아니고 전투 훈련 도와주러 가는거 겠지 거긴 민간인도 총들고 싸우는 상황이니까
P,당신의선택에응원합니다…
P,키보드 워리어들 보단백배 낫지 굿굿
N,같이 간 애들은 백수야? 직업없이 저렇게 간단니 생활에 여유가 있나보네 좋겟다
P,인생의 패배자들이 악플달고 모함할때 꿋꿋하게 자신의 신념을 지키는 사람이네요.. 진짜 방구석 여포 악플러들은 반성이라는것도 모르고 아직도 악플쓰던대 ㅠ
N,여러분 죽을수도있습니다 러시아가 무지막지 하거든요
P,남자다
P,푸틴이 계산하지 못한 또 한가지 실수. 세계 의용군.
N,"여행금지국가 많이들 가더라.... 그때가 아프간이었나??? 샘*교회에서 나랏돈 많이 쓰게하고, 돌아오면서 면세점 쇼핑도하고, 국가에다 빨리 안구해졌다고 손해배상청구도 했었지"
P,와 ..진짜 멋있다..
N,"나라법이 더 중요하다 ,자기나라법어기고 남의나라 도우러간다니 어이없다. 법을 이리대놓고 어겨도 되는거냐옳은일하는데 누가 끌어내리는것과 이런행동이 뭔 상관이냐 불법행위라면 하지마라!!"
P,이근이 욕할수없을것같다ㅡ죽을수도 있는데 ㅡ용기가 존경스럽다ㅠ 지지한다.
N,푸틴이 참견하는국가 가만안둔다고 했는데... 이근때문에 태한민국가 러시아 전쟁나면 대배이다
P,와 대단하다 그 용기가 그 마음이
P,전쟁터에 팀꾸려서 가다니..진짜 사나이..
N,가서 반성하고 죗값을 치르길 ㅎㅎ사기꾼 늠 ㅎㅎ
P,이근 대위와 같이 가신 분들 모두 건강하게 귀국하시길 진심으로 바랍니다.
N,관상
P,부디 건강히 잘 돌아와주세요.
N,관종이네 ㅋㅋ 니가 가서 할수 있는게 뭔데??
N,갈거면 조용히 갔다와라 떠벌리지말고 .. 갔다와서 또 방송이며 유투브도 하지말고.. 프틴 목따오면 인정
N,괜히 법이 있는 게 아니다.
P,이근대위 꼭 살아돌아 오세요.기다릴게요.
P,당신의 선택을 존중합니다. 전쟁은 생사가 공존합니다. 지옥을 경험 할지도 모릅니다. 살아서 돌아 오십시오.
P,응원합니다. 이근대위님 용기와 실행력..
N,이사람들이 정신이 있나없나 가뜩이나 푸틴이 돕는나라 있으면 핵쓰겠다고 그러는데 당신들 객기에 우리나라가 핵사용 뽄베기 국가가 되면 어쩔려고 그러냐 갈려면 국적 버리고가서 도와라
P,아갈파이터 빨갱이들이랑 질이다르다~~~
N,진짜 제대로 갔는지는 모르겠다.. ㅋㅋ
P,유튭 컨텐츠 뽑으러 간거아니라면 멋찌다
N,멋있기는 개뿔! 얘는 늘 범법행동을하더라 벌금또 생긴겠네! 국가에서 하지말라고한 행동은 꼭 하더라 심하게 관종병인듯!
P,이근 멋지다 자랑 스럽다 꼭 성공해서 돌아오길 건투를 빈다
P,무식한 댓글들 이해할수가없네ㅡㅡ관종이라고 다 전쟁터까지 갑니까? 니들은 죽어도 못할 정말 어려운일을 하는사람들에게 이러지들 말자요.
P,다시 보게 되네
P,다른게 다 가짜라도 저건 진짜다 인정!!!
P,꼭 살아서 귀환하라~~~~♡
N,딸근?
P,푸틴모가지따와라
